Project Name,Project Description,Keywords Found in Project Name,Keywords Found in Project Description
Dairy Farm Development Project,This project focuses on improving dairy production through modern farming techniques and milk processing facilities.,[],"['dairy', 'milk']"
Beef Cattle Health Initiative,Enhancing beef cattle health through veterinary services and disease prevention measures.,[],"['beef', 'disease', 'health']"
Poultry Feed Efficiency Program,Improving feed efficiency for poultry farms to reduce costs and increase protein production.,[],"['efficiency', 'feed', 'poultry', 'protein']"
Sustainable Agriculture Project,General agricultural development with focus on crop production and soil health.,[],['health']
Water Management System,Water conservation and irrigation systems for agricultural use.,[],[]
Livestock Market Access,Connecting livestock farmers to markets and improving meat and dairy exports.,[],"['dairy', 'livestock', 'meat']"
Goat Genetics Improvement,Genetic improvement program for goat herds to increase milk and meat production.,[],"['goat', 'meat', 'milk']"
Pasture Management Training,Training farmers in pasture management and grazing techniques for sustainable livestock farming.,[],"['grazing', 'livestock', 'pasture']"
